{
  "schema_version": "ai-auditor-findings/v1",
  "generated_at": "2026-08-10T18:00:00Z",
  "source": {
    "inventory_schema_version": "1.0",
    "collected_at": "2026-08-10T17:55:00Z",
    "host": "example-host",
    "inventory_sha256": "aaaaaaaaaaaaaaaaaaaaaaaaaaaaaaaaaaaaaaaaaaaaaaaaaaaaaaaaaaaaaaaa"
  },
  "analysis": {
    "engine": "example-static-review",
    "model": null,
    "prompt_version": "inventory-review/v1",
    "limitations": [
      "Example data only",
      "No configuration contents or logs were collected"
    ]
  },
  "summary": {
    "total": 1,
    "critical": 0,
    "high": 0,
    "medium": 1,
    "low": 0,
    "info": 0
  },
  "findings": [
    {
      "id": "AIA-0001",
      "title": "Example failed service requires review",
      "severity": "medium",
      "category": "service-health",
      "status": "open",
      "confidence": 0.85,
      "sensitivity": "internal",
      "evidence": [
        {
          "section": "systemd.failed_units",
          "path": "/systemd/failed_units/items/0",
          "observation": "example.service reported a failed state"
        }
      ],
      "rationale": "A failed enabled service can indicate unavailable functionality or an incomplete recovery.",
      "impact": "The service's intended function may be unavailable.",
      "recommendation": "Confirm whether the service is required, then inspect its status and logs through an approved drill-down path.",
      "references": []
    }
  ]
}
